subreddit,username,thread
Ultralight,trailmix_pdx,"Anyone else priced out of GPS watches? I want offline maps and a week of battery and every option is $500+. The sub-$200 stuff has GPS that's off by a mile. There is nothing in the middle and it's maddening."
Ultralight,granite_ridge,"Counterpoint: you're paying for the GPS chip and the battery, and those don't get cheaper just because you want them to. That said, I'd buy a stripped-down Fenix in a heartbeat. Drop the maps, keep the antenna, charge me $300."
GarminWatches,quietmiles,"Bought the Forerunner as my first Garmin at 24. Love the hardware, hate that Connect wants to tell me my ""body battery."" Just give me GPS, elevation, and battery life."
GarminWatches,northface_nate,"Garmin's problem is they've decided anyone under 30 is a runner and anyone over 40 is an adventurer. I'm 25 and I do 9 hour days in the backcountry. Where's my watch?"
trailrunning,dani_runs_atx,"My Fitbit told me I ran 4.1 miles on a loop I know is 6. If the numbers are wrong what am I even tracking? Saving up for something accurate but $300 is a lot when you're a student."
trailrunning,switchback_sam,"The strap is always where they cut costs on the budget models. Always. Ask me how I know."
hiking,batteryanxiety,"Watch died 4 hours into a 6 hour hike. No map, no way to call out. Never again. Battery life is the only spec that actually matters and it's the one nobody markets on."
hiking,alpine_lurker,"Honest question — is there any watch under $350 with real offline GPS that isn't garbage? I've been reading for weeks and I keep coming back to ""just save up for the Fenix"" which is not an answer."
